{
  "$schema": "./roi.schema.json",
  "schemaVersion": 1,
  "game": "pokemon-champions",
  "language": "zh-Hans",
  "canonicalViewport": {
    "width": 2560,
    "height": 1440
  },
  "coordinateSpace": {
    "origin": "top-left",
    "unit": "normalized",
    "relativeTo": "gameViewport"
  },
  "viewportDetection": {
    "strategy": "largest_16_9_game_content_area",
    "targetAspectRatio": "16:9",
    "notes": [
      "Some PC samples include black side bars, Android status overlays, or recording watermarks.",
      "All ROI rectangles must be relative to the detected gameViewport, not the whole screenshot."
    ]
  },
  "scenes": {
    "OWN_TEAM_MOVE_ITEM": {
      "description": "我方队伍配置-招式道具页。",
      "status": "draft",
      "samplePaths": [
        "docs/pic/own_team_move_item"
      ],
      "regions": [
        {
          "id": "scene.own_team_move_item.anchor",
          "role": "scene_marker",
          "entityType": "UNKNOWN",
          "rect": {
            "x": 0.315,
            "y": 0.172,
            "width": 0.195,
            "height": 0.052
          },
          "preprocess": {
            "colorMode": "grayscale",
            "scale": 2,
            "threshold": "adaptive",
            "sharpen": true
          },
          "match": {
            "engine": "ocr",
            "topK": 3,
            "minConfidence": 0.6
          },
          "notes": "Green Ability tab on the move/item team page."
        },
        {
          "id": "own_team_move_item.team_header",
          "role": "scene_marker",
          "entityType": "UNKNOWN",
          "rect": {
            "x": 0.155,
            "y": 0.085,
            "width": 0.69,
            "height": 0.07
          },
          "preprocess": {
            "colorMode": "grayscale",
            "scale": 2,
            "threshold": "adaptive",
            "sharpen": true
          },
          "match": {
            "engine": "ocr",
            "topK": 3,
            "minConfidence": 0.6
          },
          "notes": "Top team slot, team ID, avatar, and player name bar."
        },
        {
          "id": "own_team_move_item.slot0.pokemon_icon",
          "role": "pokemon_icon",
          "entityType": "SPECIES",
          "rect": {
            "x": 0.096,
            "y": 0.219,
            "width": 0.05,
            "height": 0.08
          },
          "preprocess": {
            "colorMode": "keep_color",
            "scale": 1,
            "sharpen": false
          },
          "match": {
            "engine": "template_match",
            "topK": 3,
            "minConfidence": 0.6
          }
        },
        {
          "id": "own_team_move_item.slot0.species_name",
          "role": "ocr_text",
          "entityType": "SPECIES",
          "rect": {
            "x": 0.141,
            "y": 0.25,
            "width": 0.118,
            "height": 0.041
          },
          "preprocess": {
            "colorMode": "grayscale",
            "scale": 2,
            "threshold": "adaptive",
            "sharpen": true
          },
          "match": {
            "engine": "ocr",
            "topK": 3,
            "minConfidence": 0.6
          }
        },
        {
          "id": "own_team_move_item.slot0.gender_icon",
          "role": "gender_icon",
          "entityType": "UNKNOWN",
          "rect": {
            "x": 0.261,
            "y": 0.251,
            "width": 0.02,
            "height": 0.033
          },
          "preprocess": {
            "colorMode": "keep_color",
            "scale": 1,
            "sharpen": false
          },
          "match": {
            "engine": "manual",
            "topK": 1,
            "minConfidence": 0.6
          }
        },
        {
          "id": "own_team_move_item.slot0.type_icons",
          "role": "type_icon",
          "entityType": "TYPE",
          "rect": {
            "x": 0.28,
            "y": 0.251,
            "width": 0.055,
            "height": 0.034
          },
          "preprocess": {
            "colorMode": "keep_color",
            "scale": 1,
            "sharpen": false
          },
          "match": {
            "engine": "template_match",
            "topK": 2,
            "minConfidence": 0.75
          }
        },
        {
          "id": "own_team_move_item.slot0.ability_name",
          "role": "ocr_text",
          "entityType": "ABILITY",
          "rect": {
            "x": 0.144,
            "y": 0.294,
            "width": 0.15,
            "height": 0.039
          },
          "preprocess": {
            "colorMode": "grayscale",
            "scale": 2,
            "threshold": "adaptive",
            "sharpen": true
          },
          "match": {
            "engine": "ocr",
            "topK": 3,
            "minConfidence": 0.6
          }
        },
        {
          "id": "own_team_move_item.slot0.item_name",
          "role": "ocr_text",
          "entityType": "ITEM",
          "rect": {
            "x": 0.144,
            "y": 0.339,
            "width": 0.165,
            "height": 0.039
          },
          "preprocess": {
            "colorMode": "grayscale",
            "scale": 2,
            "threshold": "adaptive",
            "sharpen": true
          },
          "match": {
            "engine": "ocr",
            "topK": 3,
            "minConfidence": 0.6
          }
        },
        {
          "id": "own_team_move_item.slot0.move0_type_icon",
          "role": "move_type_icon",
          "entityType": "TYPE",
          "rect": {
            "x": 0.334,
            "y": 0.253,
            "width": 0.024,
            "height": 0.033
          },
          "preprocess": {
            "colorMode": "keep_color",
            "scale": 1,
            "sharpen": false
          },
          "match": {
            "engine": "template_match",
            "topK": 2,
            "minConfidence": 0.75
          }
        },
        {
          "id": "own_team_move_item.slot0.move0_name",
          "role": "ocr_text",
          "entityType": "MOVE",
          "rect": {
            "x": 0.359,
            "y": 0.252,
            "width": 0.126,
            "height": 0.038
          },
          "preprocess": {
            "colorMode": "grayscale",
            "scale": 2,
            "threshold": "adaptive",
            "sharpen": true
          },
          "match": {
            "engine": "ocr",
            "topK": 3,
            "minConfidence": 0.6
          }
        },
        {
          "id": "own_team_move_item.slot0.move1_type_icon",
          "role": "move_type_icon",
          "entityType": "TYPE",
          "rect": {
            "x": 0.334,
            "y": 0.295,
            "width": 0.024,
            "height": 0.033
          },
          "preprocess": {
            "colorMode": "keep_color",
            "scale": 1,
            "sharpen": false
          },
          "match": {
            "engine": "template_match",
            "topK": 2,
            "minConfidence": 0.75
          }
        },
        {
          "id": "own_team_move_item.slot0.move1_name",
          "role": "ocr_text",
          "entityType": "MOVE",
          "rect": {
            "x": 0.359,
            "y": 0.294,
            "width": 0.126,
            "height": 0.038
          },
          "preprocess": {
            "colorMode": "grayscale",
            "scale": 2,
            "threshold": "adaptive",
            "sharpen": true
          },
          "match": {
            "engine": "ocr",
            "topK": 3,
            "minConfidence": 0.6
          }
        },
        {
          "id": "own_team_move_item.slot0.move2_type_icon",
          "role": "move_type_icon",
          "entityType": "TYPE",
          "rect": {
            "x": 0.334,
            "y": 0.337,
            "width": 0.024,
            "height": 0.033
          },
          "preprocess": {
            "colorMode": "keep_color",
            "scale": 1,
            "sharpen": false
          },
          "match": {
            "engine": "template_match",
            "topK": 2,
            "minConfidence": 0.75
          }
        },
        {
          "id": "own_team_move_item.slot0.move2_name",
          "role": "ocr_text",
          "entityType": "MOVE",
          "rect": {
            "x": 0.359,
            "y": 0.336,
            "width": 0.126,
            "height": 0.038
          },
          "preprocess": {
            "colorMode": "grayscale",
            "scale": 2,
            "threshold": "adaptive",
            "sharpen": true
          },
          "match": {
            "engine": "ocr",
            "topK": 3,
            "minConfidence": 0.6
          }
        },
        {
          "id": "own_team_move_item.slot0.move3_type_icon",
          "role": "move_type_icon",
          "entityType": "TYPE",
          "rect": {
            "x": 0.334,
            "y": 0.379,
            "width": 0.024,
            "height": 0.033
          },
          "preprocess": {
            "colorMode": "keep_color",
            "scale": 1,
            "sharpen": false
          },
          "match": {
            "engine": "template_match",
            "topK": 2,
            "minConfidence": 0.75
          }
        },
        {
          "id": "own_team_move_item.slot0.move3_name",
          "role": "ocr_text",
          "entityType": "MOVE",
          "rect": {
            "x": 0.359,
            "y": 0.378,
            "width": 0.126,
            "height": 0.038
          },
          "preprocess": {
            "colorMode": "grayscale",
            "scale": 2,
            "threshold": "adaptive",
            "sharpen": true
          },
          "match": {
            "engine": "ocr",
            "topK": 3,
            "minConfidence": 0.6
          }
        },
        {
          "id": "own_team_move_item.slot1.pokemon_icon",
          "role": "pokemon_icon",
          "entityType": "SPECIES",
          "rect": {
            "x": 0.515,